,Publisher,Score,Magnitude,Keywords
324,cnn.com,0.0,0.6000000238418579,dow investing mutual investors stocks scared money funds market way crisis rates 
325,cnn.com,0.20000000298023224,1.100000023841858,warning sears took struggled shopping penny company walmart million stock stores 
326,cnn.com,-0.20000000298023224,1.2000000476837158,filing spokesperson probing moonves weinstein yorker sexual company allegations misconduct york da district cbs 
327,cnn.com,0.0,0.6000000238418579,cfo shoppers left job clear jcpenney penney company ceo davis month women companys 
328,cnn.com,0.0,0.20000000298023224,thats best wall according economy quarter earnings 500 market street sp 
329,nbcnews.com,0.0,0.0,woods losing cup ryder pissed tiger 2018 
330,nbcnews.com,0.10000000149011612,0.20000000298023224,heres cup second ryder watch dont live schedules streams golf miss channel scores video nbc 
331,nbcnews.com,-0.10000000149011612,1.5,match share second report opens threatens allegations league rape fans windowclick real ronaldo win sue madrid cristiano 
332,nbcnews.com,0.0,0.8999999761581421,nike thing kaepernick ad doing company ties campaign point nfl young dropped 
333,nbcnews.com,0.0,0.5,nl title cubs set west singleseason league brewers division run yankees record dodgers rockies national 
334,nbcnews.com,-0.20000000298023224,1.399999976158142,continues hes lowry impactful week grittys know play tonight line appearance theyre maurice going numbers lines 
335,cnn.com,-0.10000000149011612,0.8999999761581421,day committee political kavanaugh democrats court supreme republican trump history hearing ford resonate 
336,cnn.com,-0.30000001192092896,1.899999976158142,support washington kavanaugh way movement vintage ahead metoo boys woman ginsburg womens hearings hearing expresses 
337,cnn.com,-0.30000001192092896,1.899999976158142,interviews quotes im nunbergs know person trumps cnn absolutely trump think page nunberg craziest bonkers 42 mean mueller sam 
338,cnn.com,0.20000000298023224,3.0999999046325684,president report watch trumps surreal bornstein trump doctors jackson doctor health tales medical 
339,cnn.com,-0.10000000149011612,0.699999988079071,entering school springs broward cnn peterson county upset deputies coral sheriffs officers sources 
340,cnn.com,-0.10000000149011612,1.100000023841858,investigation taken sources washington special charges federal filed counsel grand jury mueller exclusive 
341,cnn.com,-0.5,2.9000000953674316,hes deafening taking needs dont allegations week al cnn statement silence women franken 
342,cnn.com,0.0,1.100000023841858,obama political tweets used theorists trumps trump great donald evidence conspiracy theories 
343,cnn.com,0.0,0.20000000298023224,editors meet investment investigations russian mr retracted scaramucci standards published note links 
344,cnn.com,-0.30000001192092896,2.299999952316284,kathy strong president trumps trump video melania words griffin donald issued went wrong son 
345,cnn.com,0.0,0.800000011920929,posts cnn hanaholesolo trump video gif violence wrestling apology posted reddit statement user post 
346,cnn.com,0.10000000149011612,1.0,day obama left family president success letter trump wrote great white office inauguration read exclusive 
347,cnn.com,0.0,0.699999988079071,president isnt thing political gets trumps trump think feed ryan twitter totally paul wrong 
348,cnn.com,-0.20000000298023224,1.2999999523162842,speaking famous downplays statue liberty libertys referring house speak policy white adviser poem added english youre 
349,foxnews.com,0.0,0.699999988079071,website investigation coverage scrutiny rich subjected seth article staffer updates murder warranted standards statement 
350,foxnews.com,0.10000000149011612,1.2000000476837158,president shes political really dont try ivanka trump think table stay viewpoints politics 
351,foxnews.com,0.0,0.800000011920929,critics president skills washington surprised vindicated work ivanka trumps trump viciousness trying ferocity fathers 
352,foxnews.com,-0.5,2.9000000953674316,race named wheeler rich fox contributor rod retracted seth trump claims white lawsuit zimmerman published 
353,foxnews.com,-0.20000000298023224,1.7999999523162842,comments president mcconnell charlottesville secretary cohn mattis tillerson asked trump distancing cabinet cracks seen 
354,foxnews.com,-0.10000000149011612,0.800000011920929,president source 130g told paid trump daniels payment months giuliani hannity money cohen expenses 
355,foxnews.com,0.0,1.399999976158142,president let review speaks seized feds wont judge trumps legal trump prosecutors privilege stormy cohen materials lawyers files 
356,foxnews.com,-0.10000000149011612,0.8999999761581421,winning guilty described team verdict duncan manafort muellers prosecutors trump reveals lone holdout counts juror prevented mueller 
357,foxnews.com,0.0,1.100000023841858,political kavanaugh tries save kavanaughs know television interview court supreme fox allegations appearance chance unprecedented 
358,foxnews.com,0.0,0.6000000238418579,sale urasia deal alleged uranium presidential administration dictatorship calls trump warns foundation distraction clinton 
359,foxnews.com,-0.20000000298023224,0.8999999761581421,isnt rifle oliver school second amendment pagourtzis nra schools disease shootings attack texas leader north shooting 
360,foxnews.com,-0.30000001192092896,1.7000000476837158,bondi rogers press mr protesters documentary wont heckle showing trump believe florida outside pam 
361,foxnews.com,-0.4000000059604645,2.200000047683716,gopled committee attorney clash fox doj chilling records house rosenstein threatened general official meeting subpoena emails 
362,foxnews.com,0.0,2.0999999046325684,russia fusion demoted fox dossier doj ohr firm wife antitrump department worked fbi gps justice official 
363,foxnews.com,-0.10000000149011612,1.100000023841858,2016 state secretary fox hillary impeach trump claims think expressed election trying clinton 
364,washingtonexaminer.com,-0.10000000149011612,1.2000000476837158,obama nation senator called born bigger fear mccains john understood better mccain didnt white eulogy politics 
365,washingtonexaminer.com,-0.20000000298023224,2.0999999046325684,local washington war cost high faults military parade canceling trump bowser white politicians dc 
366,washingtonexaminer.com,0.0,0.30000001192092896,2016 influence special butina putin russian federation torshin advance trump kremlin agent charged helping national politics 
367,washingtonexaminer.com,-0.5,2.9000000953674316,moore alabama christ mary joseph allegations jesus roy comparisons comparing zeigler stop zachariah 
