,Publisher,Score,Magnitude,Keywords
159,usatoday.com,0.0,1.5,schreiber federal family girl adopted immigration age court uncle late leave adoption kansas koreanborn hyebin south 
160,usatoday.com,-0.20000000298023224,1.5,musk relinquish elon charges pay company teslas funding agreement tesla sec role remain days chairman twitter settles 
161,usatoday.com,-0.10000000149011612,2.5999999046325684,pandemic virus potential influenza killed today 100 50 world happen vaccine public according ago million health flu 
162,usatoday.com,0.0,0.20000000298023224,committee statements gave man kavanaugh kavanaughs person asks allegations judiciary investigate forward senate false fbi panel 
163,usatoday.com,-0.10000000149011612,1.0,kavanaugh brett allegations week court supreme ahead results fbi senate white looking nominee whats 
164,usatoday.com,0.0,1.600000023841858,alwyn rare sheer joe boyfriend swift west taylor swifts black showed dress outing public steps york 
165,usatoday.com,0.0,0.4000000059604645,johnson committee suggests blasey senator kavanaugh haren alleged judiciary vote false christine gop memories testimony van assault senate ford 
166,usatoday.com,0.10000000149011612,0.6000000238418579,onehanded juwan wr state johnson receiver week wide nabs play lions ohio penn usa nittany vs nominee 
167,usatoday.com,0.0,1.7000000476837158,president running im including michael elizabeth presidential according trump midterms warren look powerful shell sen hard 
168,usatoday.com,0.10000000149011612,1.899999976158142,cup ryder team european amid europe american le heard usa fans tie fight roars golf national 
169,usatoday.com,0.0,1.600000023841858,coach dodson yanks state player jimbo quarterback week arkansas win tyrel fisher usa texas facemask scuffle 
170,usatoday.com,0.0,1.2999999523162842,water area giles shark injures lobster 13 boy according encinitas southern beach california attack 
171,usatoday.com,0.0,0.20000000298023224,let manage return blue finale catcher john jays step russell toronto manager martin season gibbons 
172,usatoday.com,-0.10000000149011612,0.8999999761581421,classes thing bourdain im course yep anthony kennedy work students class film 
173,usatoday.com,0.0,0.800000011920929,winning final ryder retain cup amdimeglio wins team today pairings usa trophy expert vs picks justin united states matches 
174,usatoday.com,0.6000000238418579,3.4000000953674316,state gasstation best ratings 50 road trip coffee station states gas 
175,usatoday.com,0.20000000298023224,0.6000000238418579,weeks tv plenty movie premieres 100 best tatum celebrity ops noneseptember photos rihanna number 2018 
176,usatoday.com,0.0,2.4000000953674316,establishments date state entertainment fewest cost idea 100000 recreation average restaurants arts looking love does 
177,usatoday.com,-0.20000000298023224,2.0,flake kavanaugh country sexual confronted wont brett power women survivors jeff tell vote assault stand injustice 
178,usatoday.com,0.0,1.5,heres taussig bounced able monahan work financial wiped heather financially things divorce example son 
179,usatoday.com,-0.6000000238418579,3.200000047683716,users account data facebook biggest 50 breach worse feature accounts security million attackers access facebooks 
180,usatoday.com,0.800000011920929,4.0,sale 30 cables tv amazon cable save best price code deals weekend youre 
181,usatoday.com,-0.10000000149011612,1.7000000476837158,tattoo threatening nba fine fumes smith supreme jr wrote cover cavaliers went season players 
182,usatoday.com,-0.10000000149011612,1.7000000476837158,football state footballs college close week headlined quarterback shave winners syracuse teams clemsons lawrence tigers clemson swinney losers win 
183,usatoday.com,0.30000001192092896,1.7000000476837158,pressure nl enjoying cubs title game little really brewers lot division theyre central win battle 
184,usatoday.com,0.0,0.4000000059604645,moore president film trumpera political director movie documentaries documentary junkies guide deluge trump presidential drama nixon hottopic brings 
185,usatoday.com,0.0,0.800000011920929,entertainment season tops gaga star cooper week bradley living born toro series film lady 
186,usatoday.com,0.10000000149011612,0.800000011920929,committee right opinion coach school kavanaugh girls safesport brett longer criminal judiciary senate mcfadden basketball 
187,usatoday.com,0.0,1.399999976158142,ice sponsors immigrant rule parents longer preparing trump children getting budget detain detention westchester increase immigrants 
188,usatoday.com,-0.10000000149011612,1.7000000476837158,investigation kavanaugh testimonies republicans allegations republican cry democrats judge senate vs vote hearing ford 
189,usatoday.com,-0.20000000298023224,1.2000000476837158,committee investigation kavanaugh serve brett republican judge supreme jeff judiciary unfit senate partisan senators fbi flakes 
190,usatoday.com,-0.5,2.5999999046325684,account exposed zuckerberg view password know facebook 50 steps accounts security million social 
191,usatoday.com,-0.4000000059604645,2.5,lawmakers hearing bias search questions testify congress pichai ceo results trump sundar answer conservative google tech 
192,usatoday.com,-0.30000001192092896,2.0999999046325684,heres deliveries gig pay companies eats grubhub economy doordash salaries average uber delivering based drivers delivery 
193,usatoday.com,0.0,0.0,border getty world nonethe canada niagara awesome images river rivers 
194,usatoday.com,0.5,2.799999952316284,historic preserved left state walls place decay arrested visitors house prison bodie evocative preservation structures 
195,usatoday.com,0.0,3.200000047683716,whitey 25 gardens cities wardens biggest francisco mustvisit hidden flowers americas prison rock park alcatraz san parks 
196,usatoday.com,0.4000000059604645,3.4000000953674316,haunted rides disney characters minus world fun fantasy fear party halloween space park magic parks 
197,usatoday.com,0.10000000149011612,2.700000047683716,tv pricefor upgrade deal lowest oled e8 picture youll amazing small usually quality 
198,usatoday.com,0.800000011920929,4.300000190734863,affordable d3 cost best bobi irobot vacuums vacuum roomba 11s pet robot 2018 
199,washingtonpost.com,-0.10000000149011612,0.8999999761581421,thinks moment 2020 kavanaugh michael told bannon threat democrats trump run white democratic avenatti steve sen 
200,washingtonpost.com,-0.10000000149011612,0.800000011920929,reacted flake kavanaugh kavanaughs delay sean fox nomination ingraham jeff fbi senate maneuver senators flaked vote hannity laura 
201,washingtonpost.com,-0.10000000149011612,1.2000000476837158,man state blasey washington senator kavanaugh sexual told alleged fain wrote rapist woman senate christine denies spurred faber ford 
202,washingtonpost.com,-0.30000001192092896,1.899999976158142,settlement statements musk resigning elon company musks teslas fine investors tesla sec million executive chairman deal paying settles 
203,washingtonpost.com,-0.20000000298023224,1.100000023841858,president aclu kavanaugh nomination court supreme rights civil trump didnt nominees justice organization stays neutral typically 
204,washingtonpost.com,0.0,2.0,swetnick swetnicks kavanaugh washington school high father fontaine accuser security avenatti julie 
205,washingtonpost.com,-0.10000000149011612,1.2000000476837158,mendler blasey kavanaugh kavanaughs confusing peters open judge say belligerent sistersinlaw testimony christine fords fbi felt ford 
206,washingtonpost.com,-0.10000000149011612,0.8999999761581421,investigation kavanaugh senator watch appendectomy sullivan republicans emergency process vote didnt senate hearings sen hearing ford 
207,washingtonpost.com,0.30000001192092896,2.200000047683716,heres finally carter wayne album weezy v need lil know tha rapper money waynes 
208,washingtonpost.com,0.0,0.10000000149011612,match singles commanding woods cup ryder spieth pairings lead europe sundays molinari tiger thomas vs holds win points matches 
209,washingtonpost.com,0.10000000149011612,0.6000000238418579,hes thing movie really d tenacious wants black paid postapocalypto going gass jack 
210,washingtonpost.com,0.20000000298023224,1.399999976158142,coach looks state defense college touchdowns half quarterback week suddenly football winners vulnerable yards victory total clemson losers 
211,washingtonpost.com,-0.10000000149011612,0.800000011920929,contacts committee investigation second kavanaugh kavanaughs sexual brett judiciary woman misconduct senate house white fbi accused ford 
212,washingtonpost.com,-0.20000000298023224,2.0,political justices kavanaugh kavanaughs spotlight supreme court process democrats public defiant senate words partisan unwelcome politics 
213,washingtonpost.com,-0.10000000149011612,2.200000047683716,investigation leak turns kavanaugh west nomination week uh cry judge trump virginia rallying fight white fbi partisan rally 
214,washingtonpost.com,0.0,1.399999976158142,aba bar committee kavanaugh kavanaughs nomination republicans court american dismissed judge judiciary association ago 12 senate concerns abas 
215,washingtonpost.com,-0.20000000298023224,1.100000023841858,president aclu kavanaugh nomination court supreme rights civil trump didnt nominees justice organization stays neutral typically 
216,washingtonpost.com,0.0,0.0,test kerri washington view kavanaugh country television thinking nebraska trump husband mosleyfor laynette hearings women valerie 
217,washingtonpost.com,-0.20000000298023224,1.7000000476837158,committee moment strong political kavanaugh 2020 earned big brett democrats klobuchars trump klobuchar senate reviews demand rave 
218,washingtonpost.com,-0.20000000298023224,1.2000000476837158,kavanaugh kavanaughs protect recuse court supreme judge democrats qualified party legitimacy courts 
219,washingtonpost.com,-0.4000000059604645,2.299999952316284,man friends washington research rapists know wife rapist children tell women tracked 
220,washingtonpost.com,0.30000001192092896,1.600000023841858,president school kavanaugh exceptional yale lying elite schools told explains privilege likely upbringing 
221,washingtonpost.com,-0.4000000059604645,2.200000047683716,isnt case yearbook school kavanaugh girl girls sexual sex humiliation boys men rape women 
222,washingtonpost.com,-0.10000000149011612,2.4000000953674316,substance school kavanaugh affluent rich high parents schools ones drink students boys likely alcohol teens abuse 
223,washingtonpost.com,-0.20000000298023224,1.399999976158142,president political russia long regime realistic mr lacks iran policy iranian syria united states 
224,washingtonpost.com,0.0,1.399999976158142,resistance president breeds alarm russia pardon national department trumps presidential say trump security justice office power causes conservatives 
225,washingtonpost.com,-0.10000000149011612,1.5,oklahoma wall 1921 black haunts centuryold tulsa white greenwood race city mass hooker street massacre 
226,washingtonpost.com,0.0,0.800000011920929,wind voters left proposals britain european jeremy deal labour party wooing brexit farms radical corbyn leader free tories conference 
227,washingtonpost.com,-0.10000000149011612,1.2000000476837158,sacrifice macri food vacations argentines interest credit economic intensifies economy past inflation peso argentina children internet crisis 
228,washingtonpost.com,-0.10000000149011612,1.600000023841858,president reach hit vice indonesia palu nations tsunami earthquake city aid officials toll triggered quake death thousands 
229,washingtonpost.com,0.0,0.20000000298023224,strike scene northeast indonesia palu tsunami shore sulawesi wave earthquake nearby settlements quickly triggered 
230,washingtonpost.com,0.10000000149011612,1.2999999523162842,president running watched question presidential elizabeth trump run look warren democratic powerful sen hard 
231,washingtonpost.com,0.5,2.9000000953674316,stevenson camping boring trail dont need cooking ditch youll hanel ingredients eat mix youre meat 
232,washingtonpost.com,0.10000000149011612,0.6000000238418579,hes thing movie really d tenacious wants black paid postapocalypto going gass jack 
233,washingtonpost.com,0.4000000059604645,2.4000000953674316,washingtons meet emily glenstone washington raleses museum original work wealthy private art mitch couple rales artists 
234,washingtonpost.com,-0.10000000149011612,1.399999976158142,left fate sight standing country soy photography christopher michael work end brownmichael fidel decide cuba cubans 
235,washingtonpost.com,0.10000000149011612,0.6000000238418579,obama weeks 16 washington walk registration best worldsept post photos senate rain rally voter 
236,washingtonpost.com,-0.10000000149011612,0.800000011920929,contacts committee investigation second kavanaugh kavanaughs sexual brett judiciary woman misconduct senate house white fbi accused ford 
237,washingtonpost.com,0.0,1.399999976158142,aba bar committee kavanaugh kavanaughs nomination republicans court american dismissed judge judiciary association ago 12 senate concerns abas 
238,washingtonpost.com,0.30000001192092896,1.600000023841858,president school kavanaugh exceptional yale lying elite schools told explains privilege likely upbringing 
239,washingtonpost.com,0.0,0.0,test kerri washington view kavanaugh country television thinking nebraska trump husband mosleyfor laynette hearings women valerie 
240,washingtonpost.com,-0.20000000298023224,1.7000000476837158,committee moment strong political kavanaugh 2020 earned big brett democrats klobuchars trump klobuchar senate reviews demand rave 
241,nytimes.com,0.5,2.799999952316284,weeknight im favorites chicken week eggs fast yogurt world welcome dishes 
242,nytimes.com,-0.10000000149011612,1.7000000476837158,blasey kavanaugh senator movement limits shows ms judge metoo judiciary men power dr women panel battle 
243,nytimes.com,-0.10000000149011612,1.899999976158142,judicial demeanor whitehouse kavanaugh washington questions court supreme bitter judge neutrality klobuchar damaged nominee 
244,nytimes.com,-0.30000001192092896,2.5,investigation inconsistencies kavanaugh blasey school brett mr week alleged judge party summer testimony address dr fbi 
245,nytimes.com,0.0,1.2000000476837158,races majority confirmation political kavanaugh kavanaughs nomination republicans republican judge trump house senate midterms gop help 
246,nytimes.com,-0.10000000149011612,1.2000000476837158,ramirez swetnick details kavanaugh yale ms mr allegations fbis judge range inquiry restricted dr fbi 
247,nytimes.com,-0.4000000059604645,3.0,kavanaugh anger kavanaughs sexual male mr playbook trumps judge republican borrows woman misconduct white gardner 
248,nytimes.com,-0.10000000149011612,1.7000000476837158,settlement musk elon goprivate mr teslas company investors securities steps sec twitter chairman deal familiar lawyers 
249,nytimes.com,0.20000000298023224,1.5,local rising weeks week prices denver outpace wages housing york construction buyers market slows 
250,nytimes.com,0.10000000149011612,1.2000000476837158,job producers falling set overall event oil economic prices states important policy united leastnoticed decade 
251,nytimes.com,-0.20000000298023224,2.200000047683716,island tower indonesia mr palu pilot killing thousands tsunami hundreds sutopo earthquake indonesian morning quake devastate 
252,nytimes.com,-0.30000001192092896,1.7000000476837158,biotech president forprofit nonprofit turns stake cancer center vice startup raskin hospital kettering executive sloan windfall 
253,nytimes.com,0.20000000298023224,0.6000000238418579,scattered today best reads trove scotland save written 11 things sites working climate weekend 
254,nytimes.com,0.30000001192092896,2.0999999046325684,sound robyn week weeka journey williams good heart patients wrote things trial breakthrough medical weekend valve 
255,nytimes.com,-0.10000000149011612,0.5,test meddling weeks country week nations quiz trump spoke headlines security spent knowledge meeting united 
256,nytimes.com,0.0,1.7999999523162842,cant opinion let parents sex theyve sexual good boys say women survey movies 
257,nytimes.com,0.10000000149011612,2.0,remind opinion including club terms professor capitol mother ralph face testimony thomas hill role 
258,nytimes.com,-0.20000000298023224,2.0999999046325684,loves opinion school kavanaugh sexual brett beer suddenly football american weights quarterback playing presumed 
259,nytimes.com,0.10000000149011612,1.2000000476837158,opinion weeks book college ys handwriting shared wrote worked died words wanted read friend sam 
260,nytimes.com,0.4000000059604645,3.0,reality opinion tv television valentine shows hop reject hip women love quality 
261,nytimes.com,0.0,1.0,angry opinion political fury seven need schroeder ms think woman weapon thought sad race women wield youre 
262,nytimes.com,-0.4000000059604645,2.299999952316284,opinion does political church system poor christian bible dont understanding speak christians fit states twoparty 
263,nytimes.com,-0.10000000149011612,1.100000023841858,count opinion whitehaired blasey sexual women week watched worse think didnt dr felt assault 
264,nytimes.com,0.0,0.699999988079071,term writer second washington viewers told times mr watching shows trump million win 
265,nytimes.com,0.0,1.7000000476837158,opinion friends kavanaugh blackout wait told mr theory blackouts judge worried know things 
266,nytimes.com,0.0,1.7999999523162842,youd opinion word yogi praise watercolors longer work social mediocrity hobbies youre wealthiest 
267,nytimes.com,0.0,1.7000000476837158,eisenberg chronicler young life know world american marie sense bruce vivian shawn insanity deborah 
268,nytimes.com,0.10000000149011612,2.0999999046325684,contradiction psychology raining logical kimhi dont untenured world thinking unpublished philosopher believe inspired cult following logic 
269,nytimes.com,0.0,2.799999952316284,moment paris future spend know french husband amazing fact selves forever possible youre 
270,nytimes.com,0.5,2.799999952316284,weeknight im favorites chicken week eggs fast yogurt world welcome dishes 
271,nytimes.com,-0.10000000149011612,1.7000000476837158,blasey kavanaugh senator movement limits shows ms judge metoo judiciary men power dr women panel battle 
272,nytimes.com,-0.10000000149011612,1.899999976158142,judicial demeanor whitehouse kavanaugh washington questions court supreme bitter judge neutrality klobuchar damaged nominee 
273,nytimes.com,-0.30000001192092896,2.5,investigation inconsistencies kavanaugh blasey school brett mr week alleged judge party summer testimony address dr fbi 
274,nytimes.com,0.0,1.2000000476837158,races majority confirmation political kavanaugh kavanaughs nomination republicans republican judge trump house senate midterms gop help 
275,nytimes.com,-0.10000000149011612,1.2000000476837158,ramirez swetnick details kavanaugh yale ms mr allegations fbis judge range inquiry restricted dr fbi 
276,nytimes.com,-0.4000000059604645,3.0,kavanaugh anger kavanaughs sexual male mr playbook trumps judge republican borrows woman misconduct white gardner 
277,nytimes.com,-0.10000000149011612,1.7000000476837158,settlement musk elon goprivate mr teslas company investors securities steps sec twitter chairman deal familiar lawyers 
278,nytimes.com,0.20000000298023224,1.5,local rising weeks week prices denver outpace wages housing york construction buyers market slows 
279,nytimes.com,0.10000000149011612,1.2000000476837158,job producers falling set overall event oil economic prices states important policy united leastnoticed decade 
280,nytimes.com,-0.20000000298023224,2.200000047683716,island tower indonesia mr palu pilot killing thousands tsunami hundreds sutopo earthquake indonesian morning quake devastate 
281,nytimes.com,-0.30000001192092896,1.7000000476837158,biotech president forprofit nonprofit turns stake cancer center vice startup raskin hospital kettering executive sloan windfall 
282,nytimes.com,0.20000000298023224,0.6000000238418579,scattered today best reads trove scotland save written 11 things sites working climate weekend 
283,nytimes.com,0.30000001192092896,2.0999999046325684,sound robyn week weeka journey williams good heart patients wrote things trial breakthrough medical weekend valve 
284,nytimes.com,-0.10000000149011612,0.5,test meddling weeks country week nations quiz trump spoke headlines security spent knowledge meeting united 
285,nytimes.com,0.0,1.7999999523162842,cant opinion let parents sex theyve sexual good boys say women survey movies 
286,nytimes.com,0.10000000149011612,2.0,remind opinion including club terms professor capitol mother ralph face testimony thomas hill role 
287,cnn.com,0.4000000059604645,1.600000023841858,samsung right watch world cnnvr vr try video way app 
288,cnn.com,-0.10000000149011612,0.5,murphy word came hillary clintons idea cnn guest written kind bergen brown english actually cameo 
289,cnn.com,0.10000000149011612,0.800000011920929,update premiere hell weeks snl widely west wont strain trump material season weekend hosted 
290,cnn.com,-0.10000000149011612,0.699999988079071,hes school high night oath comedy hart haddish fans tiffany teddy telling skip 
291,cnn.com,0.0,2.200000047683716,college ncaa indicts football documentary play student athlete james nick nfl hbo lebron pays basketball 
292,cnn.com,0.10000000149011612,1.2000000476837158,satisfying thrones turner game viewers really divided world shows finale lot think fans sophie ending series way 
293,cnn.com,0.30000001192092896,2.0999999046325684,hall viewing person request interest good makes friended continued miles works religion god series 
294,cnn.com,-0.30000001192092896,1.5,hide streaming prime amazon hulu caption netflix 35photos film whats 
295,cnn.com,0.10000000149011612,2.299999952316284,right yeti migo songs clouds animated takes saw steps village mountains kirkpatrick direction smallfoot voiced 
296,cnn.com,-0.10000000149011612,1.5,28 wayne carter album true v dont lil tha thacarterv way released 
297,cnn.com,-0.20000000298023224,1.7999999523162842,vows jwoww superior share roger star stars filed turned saying shore jersey husband marriage divorce win 
298,cnn.com,0.10000000149011612,0.8999999761581421,tom rogers today coming neighborhood need yearmister weekly picture upcoming hanks pictures mister film 
299,cnn.com,-0.699999988079071,3.5999999046325684,wrong apologizes sexual bennett rose argento rosemcgowan dove asia mcgowan statement text 
300,cnn.com,-0.30000001192092896,3.5,cant hot away hell cheetos week drug lil wrote flamin wanna xan stay wasnt video 
301,cnn.com,-0.20000000298023224,1.7000000476837158,unfold cultures taking kavanaugh animal period sex comedies house pop look popular hearings era movies released 
302,cnn.com,0.30000001192092896,1.7999999523162842,sound school star told university music prince degree cnn posthumously minnesota wccoread universitys probably awarded honorary 
303,cnn.com,0.4000000059604645,2.299999952316284,oath wide comedy youll range sign think haddish say white tiffany youve showcases worstread 
304,cnn.com,0.0,0.20000000298023224,revealed premiere viewers randall told comes toby question think going season way mystery 
305,cnn.com,0.4000000059604645,2.200000047683716,sentenced cosby cosbys separating wonder serve lesson person ways childhood public private wholesomeness worked went bill wealthiest 
306,cnn.com,0.0,0.30000001192092896,goth divorcing ceremony told shia representative wife filed transformers labeouf divorce mia 
307,cnn.com,0.20000000298023224,2.9000000953674316,meet abc stars juniors boo age professional pippen youngest dancing mentored spelling cast season 
308,cnn.com,-0.20000000298023224,1.899999976158142,davidson stern weeks thrilled told threats wanted grande shoot ariana pete ugly death 
309,cnn.com,0.0,2.5,equivalent album latest underwood country week biggest charts makes pretty chart history topped carrie units 
310,cnn.com,0.30000001192092896,1.5,witness youngster west surprise debut runway favorite kardashian makes westnorth fashion north lol 
311,cnn.com,-0.30000001192092896,2.0,knightley writers 19th movie borden colette work lizzie woman wrote filter history prism willy century lgbt 
312,cnn.com,-0.10000000149011612,1.2999999523162842,wilde melodrama creator fogelman life wrapping key wrote stumbles olivia weave central various 
313,cnn.com,0.0,0.699999988079071,redford man banks forest gun provides old robert ammo forests written waltzes character film 
314,cnn.com,0.10000000149011612,1.0,moore turns michael parties point win cnn heat trump winds passionate wicked fahrenheit 119 disjointed election multiple 
315,cnn.com,-0.10000000149011612,1.0,producer weinstein farrow ronan told times interview farrows harvey worked breaks silence published reporting mchugh statement nbc 
316,cnn.com,0.0,0.4000000059604645,hall called fox dobbs stelter live media trumps boosters mirrors trump democrats protrump hannity twitter 
317,cnn.com,0.0,1.2999999523162842,theater greatly movie tickets moviepass company week demise price subscription stock talk exaggerated service 
318,cnn.com,0.20000000298023224,2.200000047683716,murdoch wieser fox rupert company week media summer good murdochs things 21st sinclair fortune century 
319,cnn.com,0.0,0.0,experience best reads enable summer better javascript enjoy beach 
320,cnn.com,0.0,0.0,shop right experience best celebrity products enable better javascript beauty 
321,cnn.com,0.0,0.0,shop right affordable experience best outdoor enable projectors better javascript 
322,cnn.com,-0.10000000149011612,1.399999976158142,tokens access apps log passwords facebook reset security hack login accounts affected youre 
323,cnn.com,-0.4000000059604645,2.0,unit settlement mishandling charges fees lendingclub company investors dolan loans sec money funds statement laplanche 
